{
  "schema_version": "benchmark-v1",
  "benchmark": {"name": "issue-12-benchmark", "version": 1},
  "inputs": {
    "model": {"id": "Qwen3.5-27B-Q8_0", "quantization": "Q8_0", "sha256": "6b0a101b0a86697fe11eabcc1a7db72699a9f3d4b18b6a1ac75ea3fb2c26c450"},
    "runtime": {"ref": "b10446", "commit": "adb55e5", "source": "observed", "synthetic_fixture": false},
    "prompt": {"token_count": 25, "observed_token_count": 25, "tokenizer": {"pinned": true, "preflight": true}},
    "output": {"token_count": 8}, "context_tokens": 32768,
    "lifecycle": {
      "modes": ["cold", "warm"], "warmup": false,
      "cold": {"cache_miss": true, "new_process": true, "warmup": false, "checksum_before_preparation": true, "cache_preparation": "deferred", "verifiable_or_deferred": true},
      "warm": {"cache_hit": true, "new_process": true, "warmup": false, "observed_after": "cold", "follows_observed_first_run": true}
    },
    "candidate": {"status": "pass", "tuple_id": "86535f788b85182129f52059c677a511e5ad44f9f7c4c156f703b0547b8130da", "parameters": {}, "quality": {}, "evidence": {}, "evidence_id": "42684fbf480e380a3c7285a3ebdb952c5e16805b1b58c8e4f79822ef7389a09a"}
  },
  "runs": [
    {"mode": "cold", "cache": "miss", "status": "fail", "lifecycle": {"started": true, "bounded": true, "finished": true, "warmup": false, "new_process": true, "cache_evidence": {"checksum_before_preparation": true, "preparation": "not-requested", "honest_status": "deferred"}}, "metrics": {"load_time_ms": 1250, "ttft_ms": 37, "prompt_eval_ms": 1000, "prompt_tokens": 25, "prompt_tokens_per_second": 25, "generation_eval_ms": 500, "generation_tokens": 8, "generation_tokens_per_second": 16}, "hardware": {"selected_gpu": "Vulkan0", "pci_id": "1002:73BF", "samples": [{"pci_id": "1002:73BF", "drm_device": "/dev/dri/card1", "source": "drm", "vram_capacity_mib": 16368, "vram_used_mib": 1024, "ram_available_mib": 50000, "swap_in_pages": 0}, {"pci_id": "1002:73BF", "drm_device": "/dev/dri/card1", "source": "drm", "vram_capacity_mib": 16368, "vram_used_mib": 1024, "ram_available_mib": 50000, "swap_in_pages": 0}], "sampling": {"owner": "runner", "source": "drm", "continuous": true, "proc_root": "/proc"}, "ram": {"minimum_available_mib": 50000, "passed": true}, "vram": {"capacity_mib": 16368, "peak_mib": 1024, "passed": true}, "swap": {"in_pages": 0, "passed": true}}, "settings": {"model": "Qwen3.5-27B-Q8_0", "quantization": "Q8_0", "build": {"ref": "b10446", "commit": "adb55e5"}, "device": {"selected_gpu": "Vulkan0"}, "context_tokens": 32768, "parameters": {}}, "quality": {"suite": "issue-11-evaluation", "report_sha256": "0000000000000000000000000000000000000000000000000000000000000000", "passed": true}},
    {"mode": "warm", "cache": "hit", "status": "fail", "lifecycle": {"started": true, "bounded": true, "finished": true, "warmup": false, "new_process": true, "cache_evidence": {"checksum_before_preparation": true, "preparation": "after-cold-process-before-second-process", "honest_status": "deferred"}}, "metrics": {"load_time_ms": 1250, "ttft_ms": 37, "prompt_eval_ms": 1000, "prompt_tokens": 25, "prompt_tokens_per_second": 25, "generation_eval_ms": 500, "generation_tokens": 8, "generation_tokens_per_second": 16}, "hardware": {"selected_gpu": "Vulkan0", "pci_id": "1002:73BF", "samples": [{"pci_id": "1002:73BF", "drm_device": "/dev/dri/card1", "source": "drm", "vram_capacity_mib": 16368, "vram_used_mib": 1024, "ram_available_mib": 50000, "swap_in_pages": 0}, {"pci_id": "1002:73BF", "drm_device": "/dev/dri/card1", "source": "drm", "vram_capacity_mib": 16368, "vram_used_mib": 1024, "ram_available_mib": 50000, "swap_in_pages": 0}], "sampling": {"owner": "runner", "source": "drm", "continuous": true, "proc_root": "/proc"}, "ram": {"minimum_available_mib": 50000, "passed": true}, "vram": {"capacity_mib": 16368, "peak_mib": 1024, "passed": true}, "swap": {"in_pages": 0, "passed": true}}, "settings": {"model": "Qwen3.5-27B-Q8_0", "quantization": "Q8_0", "build": {"ref": "b10446", "commit": "adb55e5"}, "device": {"selected_gpu": "Vulkan0"}, "context_tokens": 32768, "parameters": {}}, "quality": {"suite": "issue-11-evaluation", "report_sha256": "0000000000000000000000000000000000000000000000000000000000000000", "passed": true}}
  ],
  "summary": {"status": "fail", "passed_runs": 0},
  "safety": {"selected_gpu": "Vulkan0", "selected_pci_id": "1002:73BF", "swap_in_pages": 0, "ram_passed": true, "vram_passed": true},
  "provenance": {"config_sha256": "0000000000000000000000000000000000000000000000000000000000000000", "tuning_result_sha256": "0000000000000000000000000000000000000000000000000000000000000000", "evaluator_report_sha256": "0000000000000000000000000000000000000000000000000000000000000000", "artifact_sha256": "0000000000000000000000000000000000000000000000000000000000000000", "sanitized": true}
}
